{
  "schema_version": 1,
  "name": "lane-completed-before-done",
  "description": "A completed response is rejected until its single output-text lane is finalized.",
  "media": "image",
  "chunks": [
    "<0f>0<|box;x1=1;y1=2;x2=5;y2=6;w=20;h=10|><|mask;x=0;y=0;data=5,5,!!!!!(QO(0lu8?|>\n"
  ],
  "events": [
    {
      "type": "output_text_delta",
      "lane": {
        "item_id": "message-early-complete",
        "output_index": 0,
        "content_index": 0
      },
      "chunk": 0
    },
    {
      "type": "response_completed"
    }
  ],
  "expected": {
    "snapshots": [
      {
        "media": "image",
        "revision": 1,
        "records": [
          {
            "kind": "box",
            "order": 0,
            "object_id": "0",
            "frame_index": null,
            "left": 1,
            "top": 2,
            "right": 6,
            "bottom": 7
          },
          {
            "kind": "mask",
            "order": 1,
            "object_id": "0",
            "frame_index": null,
            "identity": {
              "media": "image",
              "frame_index": null,
              "object_id": "0"
            },
            "revision": 1,
            "mask": {
              "encoding": "one_bit",
              "payload": "!!!!!(QO(0lu8?",
              "width": 5,
              "height": 5,
              "decoded": {
                "length": 25,
                "runs": [
                  {
                    "value": 1,
                    "length": 1
                  },
                  {
                    "value": 0,
                    "length": 2
                  },
                  {
                    "value": 1,
                    "length": 1
                  },
                  {
                    "value": 0,
                    "length": 3
                  },
                  {
                    "value": 1,
                    "length": 2
                  },
                  {
                    "value": 0,
                    "length": 6
                  },
                  {
                    "value": 1,
                    "length": 1
                  },
                  {
                    "value": 0,
                    "length": 1
                  },
                  {
                    "value": 1,
                    "length": 4
                  },
                  {
                    "value": 0,
                    "length": 3
                  },
                  {
                    "value": 1,
                    "length": 1
                  }
                ]
              },
              "raster": [
                1, 0, 0, 1, 0, 0, 0, 1, 1, 0, 0, 0, 0, 0, 0, 1, 0, 1, 1, 1, 1,
                0, 0, 0, 1
              ],
              "coco_rle": {
                "size": [5, 5],
                "counts": "01214OK0010O31"
              },
              "svg_path": "M-0.5 0L0 -0.5L0.5 0L0 0.5ZM2.5 0L3 -0.5L3.5 0L3.5 1L3 1.5L2 1.5L1.5 1L2 0.5ZM-0.5 3L0 2.5L0.5 3L0.5 4L0 4.5L-0.5 4ZM1.5 3L2 2.5L3 2.5L4 2.5L4.5 3L4.5 4L4 4.5L3.5 4L3 3.5L2 3.5Z"
            },
            "bounds": {
              "left": 1,
              "top": 2,
              "right": 6,
              "bottom": 7
            }
          }
        ],
        "diagnostics": [],
        "raw_output": "<0f>0<|box;x1=1;y1=2;x2=5;y2=6;w=20;h=10|><|mask;x=0;y=0;data=5,5,!!!!!(QO(0lu8?|>\n"
      }
    ],
    "error": {
      "code": "response_lane",
      "message": "The response completed before finalizing one output text lane.",
      "expected_lane": {
        "item_id": "message-early-complete",
        "output_index": 0,
        "content_index": 0
      },
      "received_lane": null
    }
  }
}
